{
  "schema_version": "1.0.0",
  "algorithm_id": "afs-kex",
  "name": "AFS-KEX",
  "full_name": "Authenticated Forward-Secure Key Exchange: pMAKE-BW and pUAKE-BW",
  "version": "1.0 (2026-06-29)",
  "function": "key_exchange",
  "submission_path": "KeyExchange/AFS-KEX.zip",
  "aliases": ["AFS-KEX-BW", "pMAKE-BW", "pUAKE-BW"],
  "overview_classification": {
    "mathematical": {"family": "lattice_based", "subcategory": "mlwe_based", "label_en": "Module-LWE lattice with Barnes-Wall lattice coding", "label_zh": "基于 Module-LWE 与 Barnes-Wall 格编码的格密码"},
    "protocol": {"family": "authenticated_key_exchange", "subcategory": "kem_based_mutual_ake", "label_en": "KEM-based mutually authenticated key exchange (primary pMAKE-BW profile)", "label_zh": "基于 KEM 的双向认证密钥交换（主方案 pMAKE-BW）"},
    "summary_label_zh": "MLWE/Barnes-Wall 格基、基于 KEM 的四消息双向认证 AKE（另含三消息单向认证变体）"
  },
  "protocol_characteristics": {
    "interaction_type": "interactive",
    "message_flows": 4,
    "round_trips": 2,
    "authentication": {"type": "mutual", "authenticated_roles": ["initiator", "responder"], "mechanism": "Primary pMAKE-BW authenticates both parties by reconstructing each certified static BW-KEM public key from a session-specific combined key and an XOR-protected ephemeral seed, followed by CA verification; no online digital signature is used."},
    "roles": [
      {"role": "initiator", "long_term_key_required": true, "ephemeral_key_required": true, "key_details": "Holds a certified static BW-KEM key pair and creates fresh seed_A, ephemeral key material, and a combined key cpk_A/csk_A."},
      {"role": "responder", "long_term_key_required": true, "ephemeral_key_required": true, "key_details": "Holds a certified static BW-KEM key pair and creates fresh seed_B, ephemeral key material, and a combined key cpk_B/csk_B."}
    ],
    "pre_distributed_material": ["CA trust anchor or equivalent authenticated public directory", "NGCC evaluation profile pre-provides each peer's static and combined public keys before the online four-pass exchange"],
    "forward_secrecy": {"level": "perfect_forward_secrecy", "conditions": "Claimed in the post-eCK-PFS model for fresh completed sessions; later static-key compromise alone must not be combined with disallowed session-key or relevant ephemeral-state exposure."},
    "key_confirmation": "Explicit authentication and key confirmation are claimed. In the NGCC implementation, pass 4 carries no payload and completes responder-side verification/confirmation.",
    "transcript_binding": "The generic pMAKE session key derives from both AFS-KEM secrets and the protocol's certified-identity/public-key reconstruction; the security definition matches the KEM-related transcript (cpk_A, cpk_B, ct_A, ct_B). The implementation KDF consumes K_B || K_A after the interface has bound the supplied public keys and protected seeds.",
    "identity_binding": "Each recovered static public key is checked against the claimed identity through CAVerf; the generic protocol sends identities during the handshake, whereas the NGCC profile assumes peer static/combined public keys are already supplied."
  },
  "technical_classification": {
    "construction_paradigm": "Signature-free post-specified-identity AKE built from an authenticated forward-secure KEM; the primary pMAKE composes two AFS-KEM contributions, while pUAKE uses one.",
    "underlying_primitives": [
      {"name": "AFS-KEM-BW", "role": "Combines certified static and fresh ephemeral BW-KEM keys into a session-specific encapsulation target"},
      {"name": "BW-KEM", "role": "Native encapsulation/decapsulation primitive reused without changing its interface"},
      {"name": "BW-PKE / FO_AFS", "role": "CPA encryption core and Fujisaki-Okamoto-style transform supporting the claimed CCA properties"},
      {"name": "PRF/XOF and XOR seed protection", "role": "Derives the session key and two seed-protection keys from K_A and K_B"},
      {"name": "SM3-based hash/XOF", "role": "NGCC implementation hashing and extendable-output backend"}
    ],
    "hard_problems": [{"name": "Module Learning With Errors (MLWE)", "role": "Security foundation of BW-KEM/AFS-KEM-BW and the AKE reductions"}],
    "mathematical_structures": ["R_q = Z_q[x]/(x^N+1)", "module lattices of rank k", "centered binomial secrets/errors", "nested Barnes-Wall lattice codes BW8/BW32", "component-wise static/ephemeral key composition"],
    "security_models": ["post-specified-identity post-eCK-PFS", "ROM", "QROM", "IND-ECPA", "IND-SCCA", "IND-LCK-SCCA", "explicit authentication", "match soundness"]
  },
  "protocol_flow": [
    {"flow": 1, "sender": "initiator", "receiver": "responder", "message_id": "m1", "components": [{"name": "ct_B", "semantics": "BW-KEM ciphertext encapsulated to responder combined public key cpk_B."}], "semantics": "NGCC evaluated profile pass 1. The generic post-ID pMAKE specification instead sends cpk_A in round 1."},
    {"flow": 2, "sender": "responder", "receiver": "initiator", "message_id": "m2", "components": [{"name": "ct_A", "semantics": "BW-KEM ciphertext encapsulated to initiator combined public key cpk_A."}, {"name": "c_seed_B", "semantics": "XOR protection K_ENC^B XOR seed_B used by the initiator to reconstruct and verify responder static key material."}], "semantics": "NGCC evaluated profile pass 2; responder derives K_A and decapsulates ct_B to obtain K_B."},
    {"flow": 3, "sender": "initiator", "receiver": "responder", "message_id": "m3", "components": [{"name": "c_seed_A", "semantics": "XOR protection K_ENC^A XOR seed_A used by the responder to reconstruct and verify initiator static key material."}], "semantics": "Initiator decapsulates ct_A, derives the session and seed-protection keys, verifies responder key binding, and returns protected seed_A."},
    {"flow": 4, "sender": "responder", "receiver": "initiator", "message_id": "m4", "components": [], "semantics": "Zero-byte final pass in the NGCC implementation: responder reconstructs the initiator ephemeral key, extracts and verifies the static public key, and completes key confirmation. The generic pMAKE specification represents the final responder-to-initiator identity/protected-seed message explicitly."}
  ],
  "key_schedule": {
    "static_contributions": ["Certified static BW-KEM key components sk_A/pk_A and sk_B/pk_B are included in combined keys csk_U = sk_U + sk_Ue and cpk_U = pk_U + pk_Ue."],
    "ephemeral_contributions": ["Fresh seed_A and seed_B deterministically generate ephemeral BW-KEM key components for each session.", "K_A and K_B are the two BW-KEM shared secrets encapsulated to cpk_A and cpk_B."],
    "transcript_hash": "No separate transcript-hash formula is specified for the NGCC implementation; the formal analysis binds the KEM transcript (cpk_A, cpk_B, ct_A, ct_B) through the AFS-KEM construction and identity/key reconstruction.",
    "session_key_derivation": "(K_SESSION, K_AENC, K_BENC) = PRF(K_A, K_B); implementation applies the configured XOF to the concatenation K_B || K_A and emits three security-parameter-length strings.",
    "domain_separation": "BW-KEM random-oracle inputs use deterministic public-key identifiers ID(pk); no distinct textual AKE domain-separation label was found.",
    "ephemeral_secret_erasure": "The security model assumes all protocol randomness/ephemeral state is securely erased when a session accepts or rejects; encapsulation randomness is erased after computation."
  },
  "submitters": [
    {"name_en": "Yunlei Zhao", "name_zh": null, "affiliation_ids": ["aff-1"], "is_contact": true},
    {"name_en": "Biming Zhou", "name_zh": null, "affiliation_ids": ["aff-1"], "is_contact": false},
    {"name_en": "Zhixiang Zhao", "name_zh": null, "affiliation_ids": ["aff-1"], "is_contact": false},
    {"name_en": "Chaofeng Guan", "name_zh": null, "affiliation_ids": ["aff-2"], "is_contact": false},
    {"name_en": "Jian Weng", "name_zh": null, "affiliation_ids": ["aff-3"], "is_contact": false},
    {"name_en": "Songlin Li", "name_zh": null, "affiliation_ids": ["aff-1"], "is_contact": false},
    {"name_en": "Yifan Dong", "name_zh": null, "affiliation_ids": ["aff-1"], "is_contact": false},
    {"name_en": "Boyue Fang", "name_zh": null, "affiliation_ids": ["aff-1"], "is_contact": false},
    {"name_en": "Hanyu Wei", "name_zh": null, "affiliation_ids": ["aff-1"], "is_contact": false},
    {"name_en": "Wenqian Li", "name_zh": null, "affiliation_ids": ["aff-1"], "is_contact": false},
    {"name_en": "Weizhi Ao", "name_zh": null, "affiliation_ids": ["aff-1"], "is_contact": false},
    {"name_en": "Xinsheng Zhang", "name_zh": null, "affiliation_ids": ["aff-1"], "is_contact": false},
    {"name_en": "Wenbo Guo", "name_zh": null, "affiliation_ids": ["aff-1"], "is_contact": false},
    {"name_en": "Jieyu Zheng", "name_zh": null, "affiliation_ids": ["aff-1"], "is_contact": false},
    {"name_en": "Zhenhao Zhang", "name_zh": null, "affiliation_ids": ["aff-1"], "is_contact": false},
    {"name_en": "Xiao Li", "name_zh": null, "affiliation_ids": ["aff-1"], "is_contact": false}
  ],
  "affiliations": [
    {"affiliation_id": "aff-1", "name_en": "Fudan University (including College of Computer Science and Artificial Intelligence)", "name_zh": "复旦大学（含计算机科学技术学院/人工智能相关学院）"},
    {"affiliation_id": "aff-2", "name_en": "Information Engineering University", "name_zh": "信息工程大学"},
    {"affiliation_id": "aff-3", "name_en": "Jinan University", "name_zh": "暨南大学"}
  ],
  "common_parameters": {
    "primary_protocol": "pMAKE-BW",
    "secondary_protocol": "pUAKE-BW",
    "ring": "R_q = Z_q[x]/(x^N+1)",
    "q": 3329,
    "base_parameter_sets": ["AFS-KEM-BW-C128", "AFS-KEM-BW-C256", "AFS-KEM-BW-C384", "AFS-KEM-BW-C512"],
    "implemented_ngcc_parameter_sets": ["AFS-KEX-C128", "AFS-KEX-C256", "AFS-KEX-C512"],
    "noise_distribution": "Centered binomial with eta_s, eta_e, eta_ct",
    "coding": "Nested Barnes-Wall BW8 for C128 and BW32 for higher listed levels; tau=2",